{
  "$schema": "https://json-schema.org/draft/2020-12/schema",
  "title": "XLAxiom curated corpus v1",
  "type": "object",
  "required": ["corpus_version", "entry_count", "categories", "entries"],
  "properties": {
    "corpus_version": {"const": "1.0"},
    "entry_count": {"type": "integer", "minimum": 0},
    "categories": {"type": "object"},
    "entries": {"type": "array", "items": {"type": "object"}},
    "notes": {"type": "array", "items": {"type": "string"}}
  },
  "additionalProperties": false
}
